{
  "schema": "solarpunk.constraint.case_manifest.v1",
  "case_id": "AUS-001",
  "subject": "Austin controlled energy case",
  "case_type": "energy_site",
  "spatial_identity": {
    "site_id": "austin_10kw",
    "latitude": 30.2672,
    "longitude": -97.7431,
    "spatial_reference": "WGS84"
  },
  "measurement_window": {
    "start": "2026-05-01T00:00:00Z",
    "end": "2026-05-08T00:00:00Z"
  },
  "evidence_refs": [
    "781b88cf87fbe157cd0913a5364d02f316173ca8bde904a2de06cea06a690b34"
  ],
  "context_refs": [
    "resource:aus-001:pvwatts-v1"
  ],
  "default_policy_ref": {
    "id": "ENERGY-CASE-PILOT-005",
    "version": "1.0.0"
  },
  "boundaries": [
    "Controlled scenario demonstration; not a realized geospatial performance study.",
    "The attached PVWatts resource context is modeled TMY context, not observed generation evidence.",
    "The attached evidence is a controlled sample fixture, not real operator evidence or mint authority."
  ]
}
