{
  "schema": "solarpunk.constraint.case_manifest.v1",
  "case_id": "CPT-001",
  "subject": "Cape Town controlled energy case",
  "case_type": "energy_site",
  "spatial_identity": {
    "site_id": "cape_town_10kw",
    "latitude": -33.9249,
    "longitude": 18.4241,
    "spatial_reference": "WGS84"
  },
  "measurement_window": {
    "start": "2026-11-01T00:00:00Z",
    "end": "2026-11-08T00:00:00Z"
  },
  "evidence_refs": [
    "1e71694271b0f05430a6d24b10692af4714cf6d520858603eb6892554ad2548a"
  ],
  "context_refs": [
    "resource:cpt-001:controlled-tmy-v1"
  ],
  "default_policy_ref": {
    "id": "ENERGY-CASE-PILOT-005",
    "version": "1.0.0"
  },
  "boundaries": [
    "Controlled scenario demonstration; not a realized geospatial performance study.",
    "The attached resource context is a controlled TMY-shaped modeled fixture, not observed generation evidence and not an NREL/PVWatts refresh.",
    "The attached evidence is a controlled sample fixture, not real operator evidence or mint authority.",
    "Southern-hemisphere Cape Town geography is a laboratory case identity only; it does not establish empirical regional policy performance."
  ]
}
