{
  "schema": "solarpunk.constraint.case_manifest.v1",
  "case_id": "PHX-001",
  "subject": "Phoenix controlled energy case",
  "case_type": "energy_site",
  "spatial_identity": {
    "site_id": "phoenix_10kw",
    "latitude": 33.4484,
    "longitude": -112.074,
    "spatial_reference": "WGS84"
  },
  "measurement_window": {
    "start": "2026-05-01T00:00:00Z",
    "end": "2026-05-08T00:00:00Z"
  },
  "evidence_refs": [
    "efefcb972c66d4058e04e53bf06c7a32f0e827a089cf631241d1d916beb932e6"
  ],
  "context_refs": [
    "resource:phx-001:pvwatts-v1"
  ],
  "default_policy_ref": {
    "id": "ENERGY-CASE-PILOT-005",
    "version": "1.0.0"
  },
  "boundaries": [
    "Controlled scenario demonstration; not a realized geospatial performance study.",
    "The attached PVWatts resource context is modeled TMY context, not observed generation evidence.",
    "The attached evidence is a controlled sample fixture, not real operator evidence or mint authority."
  ]
}
