{
  "schema": "solarpunk.constraint.case_manifest.v1",
  "case_id": "OPS-001",
  "subject": "Operator-format CSV evidence pilot (Gate 1)",
  "case_type": "energy_site",
  "spatial_identity": {
    "site_id": "ops_sample_site",
    "latitude": 24.99,
    "longitude": 121.3,
    "spatial_reference": "WGS84"
  },
  "measurement_window": {
    "start": "2026-05-01T00:00:00Z",
    "end": "2026-05-08T00:00:00Z"
  },
  "evidence_refs": [
    "6d3e724bd4dc5b9a8ec8383eda1d35598eccbb953844c90810427451e3f28c5e"
  ],
  "context_refs": [
    "resource:tyn-001:pvwatts-v1"
  ],
  "default_policy_ref": {
    "id": "ENERGY-CASE-PILOT-005",
    "version": "1.0.0"
  },
  "boundaries": [
    "Operator-format CSV sample from data/operator/sample_operator_export.csv — public-lab shape, not a named closed-pilot archive.",
    "Evidence is unsigned generic-interval-csv; capabilities.signed is false; not mint authority.",
    "Reuses the TYN modeled PVWatts resource context for window alignment only; that context is TMY, not observed generation.",
    "A BLOCKED pilot-policy result is an expected and scientifically useful Gate 1 outcome."
  ]
}
