{
  "schema": "solarpunk.constraint.case_manifest.v1",
  "case_id": "TYN-001",
  "subject": "Taoyuan controlled energy case",
  "case_type": "energy_site",
  "spatial_identity": {
    "site_id": "taoyuan_10kw",
    "latitude": 24.99,
    "longitude": 121.3,
    "spatial_reference": "WGS84"
  },
  "measurement_window": {
    "start": "2026-05-01T00:00:00Z",
    "end": "2026-05-08T00:00:00Z"
  },
  "evidence_refs": [
    "587bcc25ed5bcbfed48be74b6679c8de174a3c2ac0eb72630c05ed88e1148d25"
  ],
  "context_refs": [
    "resource:tyn-001:pvwatts-v1"
  ],
  "default_policy_ref": {
    "id": "ENERGY-CASE-PILOT-005",
    "version": "1.0.0"
  },
  "boundaries": [
    "Controlled scenario demonstration; not a realized geospatial performance study.",
    "The attached PVWatts resource context is modeled TMY context, not observed generation evidence.",
    "The attached evidence is a controlled sample fixture, not real operator evidence or mint authority."
  ]
}
